{
  "schema_version": 2,
  "source_profile": "web-015",
  "scope": "current 14 ordered bundles + all direct dependencies; no status is a publishing authorization",
  "bundle_order": [
    "@deepseek-ai/dsh-base",
    "@deepseek-ai/dsh-web-app",
    "dsh-workspace-groups",
    "dsh-cpamc-limits",
    "dsh-client-ui-teratts",
    "dsh-ai-egress",
    "dsh-codex-auth",
    "dsh-session-persistence-jsonl-cache",
    "dsh-web-mobile",
    "dsh-fleet-cleaner",
    "dsh-review",
    "dsh-review-policy",
    "@dipertq/dsh-openviking-status",
    "@openviking/dsh-memory-plugin"
  ],
  "rows": [
    {
      "package_name": "@deepseek-ai/dsh-base",
      "bundle_id": "@deepseek-ai/dsh-base",
      "classification": "core",
      "desired_state": "enabled",
      "source_repo": null,
      "visibility": "unknown",
      "license": "MIT",
      "installed_version": "0.1.5-rc.2",
      "live_tree_sha256": "f50c4c83713516d571008579dcc719d16b023947365d4de1d410c97c2c7ebb1f",
      "source_commit": null,
      "stable_eligible": false,
      "release_strategy": "upstream-only",
      "evidence": "in-box",
      "dependency_spec": null,
      "direct_dependency": false,
      "declares_dsh_bundle": true,
      "source_dirty": null
    },
    {
      "package_name": "@deepseek-ai/dsh-web-app",
      "bundle_id": "@deepseek-ai/dsh-web-app",
      "classification": "core",
      "desired_state": "enabled",
      "source_repo": null,
      "visibility": "unknown",
      "license": "MIT",
      "installed_version": "0.1.5-rc.2",
      "live_tree_sha256": "ec83ec3e34892f5237b3d75742e032e0ae4f0bcd55e4a8d8ba3360271ed5bf9c",
      "source_commit": null,
      "stable_eligible": false,
      "release_strategy": "upstream-only",
      "evidence": "in-box",
      "dependency_spec": null,
      "direct_dependency": false,
      "declares_dsh_bundle": true,
      "source_dirty": null
    },
    {
      "package_name": "dsh-workspace-groups",
      "bundle_id": "dsh-workspace-groups",
      "classification": "operator-fork",
      "desired_state": "enabled",
      "source_repo": "PavelLizunov/dsh-workspace-groups",
      "visibility": "public",
      "license": "MIT",
      "installed_version": "0.1.1-local.20260924.1",
      "live_tree_sha256": "28db1ce3a7b7059aabf08b9e8d6df43b990955d7d37bcca177957050dee819ce",
      "source_commit": "8718d7f7590e55054dad69de1a99fd5eee8eebb2",
      "stable_eligible": false,
      "release_strategy": "single-repo",
      "evidence": "source-proven-but-release-gated",
      "dependency_spec": "file:/var/lib/dsh/.dsh/bundles/dsh-workspace-groups-0.1.1-local.20260924.1.tgz",
      "direct_dependency": true,
      "declares_dsh_bundle": true,
      "source_dirty": false
    },
    {
      "package_name": "dsh-cpamc-limits",
      "bundle_id": "dsh-cpamc-limits",
      "classification": "operator",
      "desired_state": "enabled",
      "source_repo": "PavelLizunov/ai-gateway",
      "visibility": "private",
      "license": "MIT",
      "installed_version": "0.1.1-local.20260924.3",
      "live_tree_sha256": "6cac2cac990a09d5b13c336f2f13709fcca3744b940c1712cbed24f98306e6ec",
      "source_commit": "891eb59719c0bcbf5c95193e1871563bfb0bcc74",
      "stable_eligible": false,
      "release_strategy": "monorepo-package",
      "evidence": "source-dirty-and-runtime-vendored",
      "dependency_spec": "file:/var/lib/dsh/.dsh/bundles/dsh-cpamc-limits-0.1.1-local.20260924.3.tgz",
      "direct_dependency": true,
      "declares_dsh_bundle": true,
      "source_dirty": true
    },
    {
      "package_name": "dsh-client-ui-teratts",
      "bundle_id": "dsh-client-ui-teratts",
      "classification": "binary-only",
      "desired_state": "enabled",
      "source_repo": null,
      "visibility": "unknown",
      "license": "GPL-3.0-or-later",
      "installed_version": "0.8.8-rc1.local.2",
      "live_tree_sha256": "124097e13c79c9ee5843489dbb66c2869d7688bb3a9f71d25f69587cb7c43463",
      "source_commit": null,
      "stable_eligible": false,
      "release_strategy": "binary-baseline",
      "evidence": "source-recovery-required",
      "dependency_spec": "file:/var/lib/dsh/.dsh/bundles/dsh-client-ui-teratts-0.8.8-rc1.local.2.tgz",
      "direct_dependency": true,
      "declares_dsh_bundle": true,
      "source_dirty": null
    },
    {
      "package_name": "dsh-ai-egress",
      "bundle_id": "dsh-ai-egress",
      "classification": "operator",
      "desired_state": "enabled",
      "source_repo": "PavelLizunov/dsh-ai-egress",
      "visibility": "public",
      "license": "MIT",
      "installed_version": "0.1.0",
      "live_tree_sha256": "59e4fae1835c11256fc9a8c4e6c681e72cc5f505f06dc02eb4c6b419400fe269",
      "source_commit": "a870eaa0ae11de93ea193325ff335cf6a462b9ca",
      "stable_eligible": false,
      "release_strategy": "single-repo",
      "evidence": "review-required",
      "dependency_spec": "link:/var/lib/dsh/Project/dsh-ai-egress",
      "direct_dependency": true,
      "declares_dsh_bundle": true,
      "source_dirty": true
    },
    {
      "package_name": "dsh-codex-auth",
      "bundle_id": "dsh-codex-auth",
      "classification": "third-party",
      "desired_state": "enabled",
      "source_repo": null,
      "visibility": "unknown",
      "license": "MIT",
      "installed_version": "0.3.3-rc.1",
      "live_tree_sha256": "54c405af4d384b150a235f8dab3e9bad3b0d3782131325fdf70eee38523ab6c1",
      "source_commit": null,
      "stable_eligible": false,
      "release_strategy": "upstream-only",
      "evidence": "origin-not-verified",
      "dependency_spec": "file:/var/lib/dsh/DSH-creator/dsh-upgrade-0.1.5/artifacts/dsh-codex-auth-0.3.3-rc.1.tgz",
      "direct_dependency": true,
      "declares_dsh_bundle": true,
      "source_dirty": null
    },
    {
      "package_name": "dsh-session-persistence-jsonl-cache",
      "bundle_id": "dsh-session-persistence-jsonl-cache",
      "classification": "third-party",
      "desired_state": "enabled",
      "source_repo": null,
      "visibility": "unknown",
      "license": "MIT",
      "installed_version": "0.1.5-rc.2-homelab.1",
      "live_tree_sha256": "319e08f22f6a13c6d15d6d2def00eaae8927b88ea4594394a50caed5bdb0210e",
      "source_commit": null,
      "stable_eligible": false,
      "release_strategy": "upstream-only",
      "evidence": "origin-not-verified",
      "dependency_spec": "file:/var/lib/dsh/DSH-creator/dsh-upgrade-0.1.5/artifacts/dsh-session-persistence-jsonl-cache-0.1.5-rc.2-homelab.1.tgz",
      "direct_dependency": true,
      "declares_dsh_bundle": true,
      "source_dirty": null
    },
    {
      "package_name": "dsh-web-mobile",
      "bundle_id": "dsh-web-mobile",
      "classification": "binary-only",
      "desired_state": "enabled",
      "source_repo": null,
      "visibility": "unknown",
      "license": "MIT",
      "installed_version": "2.3.1-local.20260924.1",
      "live_tree_sha256": "0aed49ba8fadb9683563a9d3aedf76c520f0d9b0e4d6e77455a409b2dc6ddbcb",
      "source_commit": null,
      "stable_eligible": false,
      "release_strategy": "binary-baseline",
      "evidence": "source-recovery-required",
      "dependency_spec": "file:/var/lib/dsh/.dsh/bundles/dsh-web-mobile-2.3.1-local.20260924.1.tgz",
      "direct_dependency": true,
      "declares_dsh_bundle": true,
      "source_dirty": null
    },
    {
      "package_name": "dsh-fleet-cleaner",
      "bundle_id": "dsh-fleet-cleaner",
      "classification": "operator",
      "desired_state": "enabled",
      "source_repo": "PavelLizunov/dsh-fleet-cleaner",
      "visibility": "public",
      "license": "MIT",
      "installed_version": "0.2.0",
      "live_tree_sha256": "adda2b4a51fd45524aed38359eaf51e4da1da291cbee04f423adabe969083dfd",
      "source_commit": "bde39a882f42efc19a4ddde12f62b1d0e593f27a",
      "stable_eligible": false,
      "release_strategy": "single-repo",
      "evidence": "dirty-betterSidebar-in-HEAD",
      "dependency_spec": "link:/var/lib/dsh/Project/dsh-fleet-cleaner",
      "direct_dependency": true,
      "declares_dsh_bundle": true,
      "source_dirty": true
    },
    {
      "package_name": "dsh-review",
      "bundle_id": "dsh-review",
      "classification": "operator",
      "desired_state": "enabled",
      "source_repo": null,
      "visibility": "unknown",
      "license": "unknown",
      "installed_version": "0.2.0",
      "live_tree_sha256": "c58bb5bb28ccfda5687c1526ca7e75d7e2059a877997c120199467d818bed8f1",
      "source_commit": null,
      "stable_eligible": false,
      "release_strategy": "source-review-required",
      "evidence": "license-and-origin-not-verified",
      "dependency_spec": "link:/var/lib/dsh/.dsh/packages/dsh-review/0.2.0",
      "direct_dependency": true,
      "declares_dsh_bundle": true,
      "source_dirty": null
    },
    {
      "package_name": "dsh-review-policy",
      "bundle_id": "dsh-review-policy",
      "classification": "operator",
      "desired_state": "enabled",
      "source_repo": "PavelLizunov/dsh-config",
      "visibility": "private",
      "license": "unknown",
      "installed_version": "0.1.0",
      "live_tree_sha256": "7a1aaf4e1e997bf9079e3e6ec0be293e0606987d3bdc9763dd6ae7a95267460d",
      "source_commit": "aaefdd06b5a0e2b02caf4bd5972636bb5de3ed5e",
      "stable_eligible": false,
      "release_strategy": "source-review-required",
      "evidence": "license-not-verified",
      "dependency_spec": "link:/var/lib/dsh/.dsh/packages-src/dsh-review-policy",
      "direct_dependency": true,
      "declares_dsh_bundle": true,
      "source_dirty": false
    },
    {
      "package_name": "@dipertq/dsh-openviking-status",
      "bundle_id": "@dipertq/dsh-openviking-status",
      "classification": "operator-fork",
      "desired_state": "enabled",
      "source_repo": "PavelLizunov/dsh-config",
      "visibility": "private",
      "license": "MIT",
      "installed_version": "0.3.2",
      "live_tree_sha256": "757d7417600e9bbce1291bb5aaf45897a404080dff3671a70b030cbb12640826",